{"actor_id":"fixture-reviewer","assumptions":[{"assumption_id":"linearity","mode":"not_applicable","rationale":"Structural example only; no scientific acceptance or real review is claimed.","scenario_ids":[]}],"created_at":"2026-09-08T00:00:00Z","ledger":{"path":"framing/assumptions.jsonl","sha256":"0000000000000000000000000000000000000000000000000000000000000000"},"models":{"baseline":{"path":"models/baseline.json","sha256":"0000000000000000000000000000000000000000000000000000000000000000"},"main":{"path":"models/main.json","sha256":"0000000000000000000000000000000000000000000000000000000000000000"}},"plan_id":"structural-assumption-fixture","question_id":"Q1","scenarios":[],"schema_version":"2.0"}
